{
  "name": "Классика",
  "bg": "#f5f5f0",
  "surface": "#ffffff",
  "ink": "#1a1a1a",
  "accent": "#1a3c5e",
  "muted": "#6b7280",
  "softAccent": "#e8eef4",
  "border": "#e5e7eb",
  "display": "'Fraunces', Georgia, serif",
  "body": "'Inter', system-ui, sans-serif",
  "radius": 12,
  "unit": 20,
  "ratio": "4/3"
}
